{
  "symbol": "GWAV",
  "company_name": "Greenwave Technology Solutions Inc",
  "ir_website": "https://www.gwav.com/",
  "structured_data": [
    {
      "section_name": "Press Releases",
      "links": [
        {
          "title": "Greenwave Technology Solutions Completes Recapitalization",
          "url": "https://www.gwav.com/greenwavetechnologysolutionscompletesrecapitalization",
          "content": "top of page\n\nSubscribe\n\n[![NASDAQ GWAV LOGO.png](https://static.wixstatic.com/media/0ae14f_a0ef0dbb4eb74d7cb98542a7d6b977f1~mv2.png/v1/fill/w_399,h_91,al_c,q_85,usm_0.66_1.00_0.01,enc_avif,quality_auto/NASDAQ%20GWAV%20LOGO.png)](https://www.gwav.com)\n\n# Greenwave Technology Solutions Completes Recapitalization\n\nLOCATION\n\nChesapeake, VA\n\nDATE\n\nJune 18, 2024\n\nCompany Strengthens Balance Sheet by $80.5 Million since February\n\n​\n\nGreenwave Attracts $45.3 Million in New Capital Infusions since March\n\n​\n\nCompany's Business Plan Fully Funded with No Current Need for Additional Capital\n\n​\n\nCHESAPEAKE, Va., June 18, 2024 /PRNewswire/ -- Greenwave Technology Solutions, Inc. (\"Greenwave\" or the \"Company\") (Nasdaq: [GWAV](https://www.prnewswire.com/news-releases/greenwave-technology-solutions-completes-recapitalization-302174713.html#financial-modal)), an operator of metal recycling facilities in Virginia, North Carolina, and Ohio, announced today the completion of its recapitalization, significantly strengthening its balance sheet. \n\n​\n\nGreenwave's Recent Highlights:\n\n  * On track to generate record revenues exceeding $40 million driven by volume of steel and copper processed in 2024 \n\n  * Strengthened balance sheet by approximately $80.5 million since February \n\n  * Attracts $45.3 million in new capital infusions since March \n\n  * Current cash balance of over $26 million \n\n  * Strongest cash position in Company history \n\n  * Business plan is now fully funded \n\n  * No current need to raise additional capital \n\n  * Company is now in full compliance with all Nasdaq listing requirements \n\n  * Intends to utilize additional cash flow from operations to aggressively grow and increase processing volume \n\n  * Anticipates starting operations of its second shredder this summer \n\n  * Plans to expand its wholly-owned technology platform, ScrapApp.com, nationwide and continue AI development \n\n  * Plans to enhance margins of its downstream processing system with implementation of new copper extraction technology \n\n  * Evaluating accretive acquisitions and strategic partnerships \n\n  * Chairman and CEO exchanged approximately $17.2 million of debt into equity\n\n\n\n\nAbout Greenwave Greenwave Technology Solutions, Inc., through its wholly owned subsidiary Empire Services, Inc. (\"Empire\"), is an operator of 13 metal recycling facilities in Virginia, North Carolina, and Ohio. The Company's recycling facilities collect, classify, and process raw scrap metal (ferrous and nonferrous).\n\nSteel is one of the world's most recycled products with the ability to be re-melted and re-cast numerous times. For more information, please visit [www.GWAV.com](http://www.GWAV.com).\n\n​\n\nForward-looking Statements This press release contains certain forward-looking statements within the meaning of the safe harbor provisions of the Private Securities Litigation Reform Act of 1995. These include, without limitation, statements about its revenue growth, opening of additional locations, margin expansion and cashflow projections. These statements are identified by the use of the words \"could,\" \"believe,\" \"anticipate,\" \"intend,\" \"estimate,\" \"expect,\" \"may,\" \"continue,\" \"predict,\" \"potential,\" \"project\" and similar expressions that are intended to identify forward-looking statements. All forward-looking statements speak only as of the date of this press release. You should not place undue reliance on these forward-looking statements. Although the Company believes that its plans, objectives, expectations and intentions reflected in or suggested by the forward-looking statements are reasonable, the Company can give no assurance that these plans, objectives, expectations or intentions will be achieved. Forward-looking statements involve significant risks and uncertainties (some of which are beyond the Company's control), assumptions and other factors that could cause actual results to differ materially from historical experience and present expectations or projections. Actual results may differ materially from those in the forward-looking statements and the trading price for the Company's common stock may fluctuate significantly. Forward-looking statements also are affected by the risk factors described in the Company's filings with the SEC. Except as required by law, the Company undertakes no obligation to update or revise publicly any forward-looking statements, whether as a result of new information, future events or otherwise, after the date on which the statements are made or to reflect the occurrence of unanticipated events.\n\nbottom of page\n"
        },
        {
          "title": "View PRs",
          "url": "https://www.gwav.com/press-releases",
          "content": "top of page\n\nSubscribe\n\n[![NASDAQ GWAV LOGO.png](https://static.wixstatic.com/media/0ae14f_a0ef0dbb4eb74d7cb98542a7d6b977f1~mv2.png/v1/fill/w_399,h_91,al_c,q_85,usm_0.66_1.00_0.01,enc_avif,quality_auto/NASDAQ%20GWAV%20LOGO.png)](https://www.gwav.com)\n\n# PRESS RELEASES\n\nWe believe consistent, honest communication with our shareholders is critical to our success.\n\n## June 18, 2024\n\nGreenwave Technology Solutions Completes Recapitalization\n\nCompany Strengthens Balance Sheet by $80.5 Million since February\n\n​\n\nGreenwave Attracts $45.3 Million in New Capital Infusions since March\n\n​\n\nCompany's Business Plan Fully Funded with No Current Need for Additional Capital\n\n[Read More](https://www.gwav.com/greenwavetechnologysolutionscompletesrecapitalization)\n\n![shutterstock_630828074.jpg](https://static.wixstatic.com/media/0ae14f_4cb75f29239f4565baa8604fe3fdee58~mv2.jpg/v1/fill/w_600,h_449,al_c,q_80,usm_0.66_1.00_0.01,enc_avif,quality_auto/shutterstock_630828074.jpg)\n\n### Greenwave Technology Solutions Completes Recapitalization\n\nJune 18, 2024\n\nCompany Strengthens Balance Sheet by $80.5 Million since February\n\n​\n\nGreenwave Attracts $45.3 Million in New Capital Infusions since March\n\n​\n\nCompany's Business Plan Fully Funded with No Current Need for Additional Capital\n\n[Read More](https://www.gwav.com/greenwavetechnologysolutionscompletesrecapitalization)\n\n### Greenwave Technology Solutions' Scrap App Sets New Daily Record\n\nJune 18, 2024\n\nGreenwave Sees Adoption of Technology and Specifically Artificial Intelligence in the $42.3 Billion U.S. Scrap Metal Industry(1) as Being a Driver for Growth and Competitive Advantage\n\n[Read More](https://www.gwav.com/scrapappsetsnewdailyrecord)\n\n### Greenwave Technology Solutions Regains Full Compliance with Nasdaq Listing Standards\n\nJune 18, 2024\n\n# Greenwave received formal notice from The Nasdaq Stock Market LLC (\"Nasdaq\") that the Company has evidenced compliance for continued listing on The Nasdaq Capital Market.\n\n[Read More](https://www.gwav.com/regainsfullcompliancewithnasdaqlistingstandards)\n\n### Greenwave Technology Solutions' Downstream Processing System Generates Record Revenues as Copper Hits All Time High\n\nJune 5, 2024\n\nCompany's Downstream Processing System Generated Record Revenues in May 2024\n\n[Read More](https://www.gwav.com/downstreamprocessingsystemgeneratesrecordrevenuesascopperhit)\n\n### Greenwave Announces Reverse Stock Split to Regain Nasdaq Compliance\n\nMay 29, 2024\n\n# Common stock will begin trading on reverse split-adjusted basis on June 3, 2024\n\n[Read More](https://www.gwav.com/greenwaveannouncesreversestocksplittoregainnasdaqcompliance)\n\n### Greenwave Eliminates All Convertible Debt\n\nMay 22, 2024\n\nFinal Conversion of $18 Million in Convertible Debt Occurred Today\n\n[Read More](https://www.gwav.com/greenwaveeliminatesallconvertibledebt)\n\n### Greenwave Technology Solutions' Exchanges All Outstanding Notes Held by its Chief Executive Officer into Equity\n\nMay 7, 2024\n\n# Additionally, Company CEO Exchanges $10 Million in Debt into Shares of Series D Preferred\n\n[Read More](https://www.gwav.com/exchangesnotes)\n\n### Greenwave Technology Solutions Further Strengthens its Balance Sheet\n\nApril 23, 2024\n\nCompany has improved its balance sheet by $27 million over the past 90 days\n\n[Read More](https://www.gwav.com/greenwavetechnologysolutionsfurtherstrengthensitsbalancesheet)\n\n### Greenwave Technology Solutions Regains Compliance with Nasdaq Market Value of Listed Securities Requirement\n\nApril 4, 2024\n\n# Nasdaq Grants Company 180 Day Extension to Regain Compliance with $1.00 Minimum Bid Price Requirement\n\n[Read More](https://www.gwav.com/nasdaq-recompliance-april-2024)\n\n### Greenwave Technology Solutions Expects to Process Record Volumes of Steel and Copper with Revenues Exceeding $40 Million in 2024\n\nMay 9, 2024\n\nGrowth Being Driven by Cleveland, OH and Virginia Beach, VA Locations\n\n[Read More](https://www.gwav.com/recordvolumesofsteelandcopper)\n\n### Greenwave Technology Solutions' Scrap App Expands to Richmond, VA Market as it Continues to Capture Market Share\n\nMarch 4, 2024\n\n# ScrapApp.com is Now Serving the Richmond Metropolitan Area – the Third Largest in the Commonwealth of Virginia – Enabling People to Get Paid for their End-of-Life Vehicles\n\n[Read More](https://www.gwav.com/scrap-app-richmond)\n\n### Greenwave Technology Solutions’ Second Shredder Scheduled to Be Connected to Power Grid by April 9, 2024\n\nFebruary 15, 2024\n\nSecond shredder is expected to double Greenwave’s ferrous metal processing capacity\n\n[Read More](https://www.gwav.com/secondshredderapril92024)\n\n### Greenwave Technology Solutions Releases Shareholder Update\n\nFebruary 13, 2024\n\n# Company on track to generate record revenues in FY 2024\n\n[Read More](https://www.gwav.com/feb-2024-shareholderupdate)\n\n### Greenwave Technology Solutions’ Scrap App Continues Capturing Market Share\n\nJanuary 24, 2024\n\nGreenwave Generated Over $200,000 in Revenue from Cars Purchased through Scrap App During its First 130 Days\n\n​\n\nCompany is Developing Artificial Intelligence to Optimize Pricing and Automate Systems to Create Efficiencies as it Continues to Capture Market Share\n\n[Read More](https://www.gwav.com/scrap-app-market-share)\n\n### Greenwave Technology Solutions Receives License from Ohio Bureau of Motor Services\n\nJanuary 24, 2024\n\n# Greenwave’s Subsidiary, Empire Metals, is Now Licensed to Purchase Scrap Cars in the State of Ohio Company’s Scrap Car Buying Platform, ScrapApp.com, Continues to Rapidly Scale\n\n[Read More](https://www.gwav.com/ohio-license)\n\n### Greenwave Technology Solutions Generates More than $9 Million Revenue in Q4 2023\n\nJanuary 22, 2024\n\nCompany Grows Revenues More than 10% Over Q3 2023\n\n​\n\nGreenwave Expects to Significantly Grow Revenues in FY 2024\n\n[Read More](https://www.gwav.com/scrap-app-cleveland)\n\n### Greenwave Technology Solutions Commences Operation of Metal Baler, Wire Stripper, and Sheers at Non-Ferrous Processing Facility\n\nJanuary 19, 2024\n\nEquipment Expected to Grow Revenues by Tens of Thousands of Dollars per Month with Signficant Margins\n\n[Read More](https://www.gwav.com/metal-baler)\n\n### Greenwave Technology Solutions' Scrap App Expands to Second Market as it Continues to Capture Market Share\n\nDecember 23, 2023\n\nGreenwave Generated Over $100,000 in Revenue from Cars Purchased through Scrap App During its First 90 Days\n\n[Read More](https://www.gwav.com/scrap-app-cleveland)\n\n### Greenwave Technology Solutions Announces its Shear Baler is Now Fully Operational at its Cleveland Facility\n\nSept 26, 2023\n\nNewly installed equipment to significantly increase facility’s metal recycling production capacity and ramp up revenue\n\n[Read More](https://www.gwav.com/cleveland-shear)\n\n### Greenwave Technology Solutions Launches Scrap App with AI Pricing Engine in Development \n\nSept 14, 2023\n\nGreenwave intends to develop Scrap App into the leading technology platform for the $41.4 billion scrap metal industry\n\n[Read More](https://www.gwav.com/scrap-app-launch)\n\n### Greenwave Technology Solutions to be Featured on Benzinga All Access at 11:00am EDT on August 30, 2023\n\nAugust 29, 2023\n\nTopics are expected to include upcoming catalysts including recently announced systems that increase capabilities to drive the company towards $50 million annual revenues \n\n[Read More](https://www.gwav.com/benzinga)\n\n### Greenwave Technology Solutions’ Copper Extraction System Expected to Commence Operations in September 2023\n\nAugust 29, 2023\n\nNew infrastructure and technology coming online to significantly increase processing capacity, resulting in increased annual revenues\n\n[Read More](https://www.gwav.com/copper-extraction)\n\n### Greenwave Technology Solutions Regains Compliance with Nasdaq Listing Standards\n\nAugust 24, 2023\n\nIn a letter dated August 18, 2023, Nasdaq informed the Company that it has achieved compliance with the minimum bid price rule required for continued listing on the Nasdaq Capital Market.\n\n[Read More](https://www.gwav.com/nasdaq-recompliance)\n\n### Greenwave Technology Solutions, Inc. Shareholder Update\n\nAugust 3, 2023\n\nCompany’s downstream processing system has commenced operations and is on track to generate in excess of $1,000,000 per month in revenue with 80%+ margins by the end of 2023.\n\n[Read More](https://www.gwav.com/aug-2023-shareholder-update)\n\n### Greenwave Technology Solutions Reports Third Highest Quarterly Revenues in Company History\n\nAugust 15, 2023\n\nGreenwave generated $1.23 million in positive cashflows from operations during the six months ended June 30, 2023, a new record for the Company.\n\n[Read More](https://www.gwav.com/q2-2023-earnings)\n\n### Greenwave Appoints Henry Sicignano III and Jason Adelman to Board of Directors\n\nAugust 10, 2023\n\n\"Greenwave strikes me as the single most compelling investment opportunity in the $41.4 billion scrap metal industry.\" - Henry Sicignano III\n\n[Read More](https://www.gwav.com/henry-sicignano-jason-adelman)\n\n### Greenwave Secures Property for Metal Recycling Facility in Cleveland, Ohio\n\nFebruary 15, 2023\n\nGreenwave is pleased to announce that it has secured the property formerly occupied by JBI Scrap Processors on East 55th Street in Cleveland, Ohio to open a scrap metal recycling facility.\n\n[Read More](https://www.gwav.com/cleveland-facility)\n\n### Greenwave Expects Optimal Market Conditions in 2023\n\nJanuary 30, 2023\n\nGreeenwave is pleased to share that it expects optimal market conditions for scrap metal recycling throughout 2023 and for the foreseeable future, with prices for many of the Company's products near record highs.\n\n[Read More](https://www.gwav.com/optimal-market-conditions)\n\n### Greenwave Secures New Customers to Increase Margins\n\nJanuary 26, 2023\n\nGreenwave is pleased to announce that over the past several months, it has established relationships with leading international and domestic steel mills to secure the best possible prices for each type of metal it processes.\n\n[Read More](https://www.gwav.com/margin-expansion)\n\n### Greenwave CEO Danny Meeks Waives Quarterly Bonuses for Fiscal Year 2023\n\nJanuary 20, 2023\n\nGreenwave’s Chief Executive Officer Danny Meeks has agreed to waive his quarterly bonuses due under his employment agreement for fiscal year 2023. This waiver is expected to reduce operating expenses and improve free cash flow by approximately $1 million.\n\n[Read More](https://www.gwav.com/bonus-waiver)\n\n### Greenwave Operating Metal Processing Facility in Chesapeake, VA\n\nJanuary 13, 2023\n\nGreenwave expects its profit margins on the metal processed through its Chesapeake facility will increase by 20-25% as a result of the Company preparing metal for steel mills, stripping wire and non-ferrous metals, and cutting metals to the proper size for shipping both international and domestic\n\n[Read More](https://www.gwav.com/chesapeake-facility)\n\n### Greenwave’s Norfolk Facility Obtains Automotive Recycler License from Virginia Department of Motor Vehicles\n\nJanuary 11, 2023\n\nThe Company’s Norfolk facility – its highest volume yard – now has the ability to purchase scrap cars directly from customers\n\n[Read More](https://www.gwav.com/norfolk-license)\n\n### Greenwave Opens 12th Metal Recycling Facility in Fairmont, NC and Announces Results of its Annual Meeting of Shareholders\n\nDecember 1, 2022\n\nGreenwave’s shareholders overwhelmingly approved each of proposed corporate actions and elected the Company’s existing board of directors by a wide margin.\n\n[Read More](https://www.gwav.com/fairmont-open)\n\n### Greenwave to Present at Dawson James Small Cap Growth Conference Today at 11:30am ET\n\nOctober 12, 2022\n\nGreenwave's Chairman and Chief Executive Officer, Danny Meeks, will be presenting at the Dawson James 7th Annual Small Cap Growth Conference this morning, October 12, 2022, at 11:30am ET.\n\n[Read More](https://www.gwav.com/cfo-appointment)\n\n### Greenwave Appoints Ashley Sickles as Chief Financial Officer\n\nSeptember 19, 2022\n\nThe Company is on track to open two additional metal recycling facilities, as well as completing the installation of its second automotive shredder to double its metal processing capacity, in the fourth quarter of 2022\n\n[Read More](https://www.gwav.com/cfo-appointment)\n\n### Greenwave to Withdraw Registration Statement on Form S-3\n\nAugust 25, 2022\n\nSimultaneous with its NASDAQ listing on July 22, 2022, all of the Company’s convertible debt converted into shares of common stock at a conversion price of $6.02 per share\n\n[Read More](https://www.gwav.com/s3-withdraw)\n\n### Greenwave Reports Record Q2 2022 Revenues and Cashflows from Operations and Announces it Will Open Two New Metal Recycling Facilities Following Listing on Nasdaq\n\nAugust 10, 2022\n\nCompany to Ring Nasdaq Opening Bell on August 10, 2022. The Company filed its Quarterly Report on Form 10-Q for the Second Quarter of 2022, reporting record revenues of $10.70 million and cashflows from operations of $566,238 for the 6 months ended June 30, 2022\n\n[Read More](https://www.gwav.com/opening-bell)\n\n### Greenwave to Begin Trading on NASDAQ at Market Open on Friday, July 22, 2022\n\nJuly 21, 2022\n\nThe Company operates 11 metal recycling facilities in Virginia and North Carolina, generating record revenues of $10.70 million during the quarter ended June 30, 2022, and is positioned for rapid expansion\n\n[Read More](https://www.gwav.com/nasdaq-uplist)\n\n### Greenwave Generates Record Revenues of $10.70 Million in Q2 2022, an Increase of 56% over Empire’s Q2 2021 Revenues\n\nJuly 5, 2022\n\nThe Company generated $10.70 million in revenue in the second quarter of 2022 and generated positive cashflows from operations for the six months ending June 30, 2022\n\n[Read More](https://www.gwav.com/opening-bell)\n\n### Greenwave Generates Record Revenues in Excess of $10 Million in Q2 2022\n\nJune 27, 2022\n\nThe Company has generated revenues in excess of $10 million during the second quarter of 2022 and expects to generate positive cashflows from operations for the six months ending June 30, 2022\n\n[Read More](https://www.gwav.com/q2-revenues)\n\n### Greenwave Gearing Up for Significant Expansion\n\nJune 21, 2022\n\nThe installation of the Company’s second automotive shredder and downstream system are on track to be completed in Q3 2022, which is expected to double its processing capacity and expand its profit margins\n\n[Read More](https://www.gwav.com/significant-expansion)\n\n### Greenwave Expects Q2 2022 Revenues to Grow by 40% over Empire’s Q2 2021 Revenues\n\nJune 7, 2022\n\nThe Company expects revenues for the second quarter of 2022 to grow by 40% over Empire’s second quarter 2021 revenues and to generate positive cashflows from operations for the six months ending June 30, 2022\n\n[Read More](https://www.gwav.com/q2-2022-growth)\n\n### Greenwave Reports Record Revenues of $9.92 Million in Q1 2022\n\nMay 16, 2022\n\nThe Company generated positive cashflows from operating activities and eliminated $44 million in derivative liabilities during the first quarter of 2022\n\n[Read More](https://www.gwav.com/q1-revenues)\n\n### Greenwave Appoints Three Independent Directors\n\nApril 20, 2022\n\nThe Company expects to submit its application to uplist to a national exchange imminently\n\n[Read More](https://www.gwav.com/board-appointments)\n\n### Greenwave Generates Revenues of $9.7 Million in Q1 2022\n\nApril 18, 2022\n\nThe Company is currently installing an additional automotive shredder and downstream system which is expected to double its processing capacity\n\n[Read More](https://www.gwav.com/q1-revenues)\n\n### Greenwave to Begin Trading Under Ticker “GWAV”\n\nMarch 25, 2022\n\nThe Company has generated record revenue in the first quarter of 2022 and is preparing its formal application to uplist to a national exchange\n\n[Read More](https://www.gwav.com/copy-of-commodities-prices)\n\n### Greenwave Experiences Margin Growth as Commodities Prices Surge to Record Highs\n\nMarch 8, 2022\n\nPrices for copper and steel – two of Empire’s main products – have increased significantly in 2022, driven by increased demand and inflationary pressures\n\n[Read More](https://www.gwav.com/copy-of-2022-outlook)\n\n### Greenwave Outlines Growth Plans for 2022\n\nMarch 7, 2022\n\nCompany plans to focus on acquiring profitable metal scrap yards in localities where the number of licenses is capped\n\n[Read More](https://www.gwav.com/copy-of-gwav)\n\n### Greenwave To Begin Trading Under Ticker “GWAV” On March 28, 2022\n\nMarch 3, 2022\n\nCompany on track to meet all stated NASDAQ listing requirements in March 2022\n\n[Read More](https://www.gwav.com/copy-of-new-machinery)\n\n### Greenwave Installing Second Automotive Shredder and Downstream Processing System\n\nFebruary 28, 2022\n\nNew Machinery Expected to More Than Double Revenue Generating Capacity\n\n[Read More](https://www.gwav.com/copy-of-share-consolidation)\n\n### Greenwave Technology Solutions to Effect Share Consolidation to Meet Nasdaq Share Price Listing Requirement\n\nFebruary 25, 2022\n\nThe effective date of the Consolidation is February 28, 2022. Trading of the Common Shares on a post-Consolidation basis will commence on or about February 28, 2022.\n\n[Read More](https://www.gwav.com/copy-of-2022-chairmans-letter)\n\n### Greenwave Technology Solutions Issues 2022 Chairman’s Letter\n\nJanuary 13, 2022\n\nFully-funded after closing a $37.7 million offering, Greenwave intends to rapidly expand its footprint of metal recycling facilities, aggressively grow its revenues, and create significant shareholder value this year\n\n[Read More](https://www.gwav.com/2022-chairmans-letter)\n\n### Greenwave’s Subsidiary, Empire Services, Generated $19.6 Million in Revenue during First Nine Months of 2021\n\nDecember 20, 2021\n\nEmpire has more than doubled its 2020 revenue in 2021 and expects to further grow its revenues and cashflows generated from operating activities in 2022\n\n[Read More](https://www.gwav.com/electrical-engineer)\n\n### Greenwave To Open its 12th Metal Recycling Facility in Fairmont, NC\n\nDecember 8, 2021\n\nThe Company has secured the licenses and permits to open its Fairmont, NC facility on or about January 12, 2022 and is expected to immediately contribute to its revenue growth\n\n[Read More](https://www.gwav.com/fairmont-opening)\n\n### Greenwave Announces $37.7 Million Private Placement\n\nDecember 1, 2021\n\nCompany has redeemed all of its Series X and Y preferred shares, retired outstanding debt prior to this offering, and will utilize additional proceeds to accelerate revenue growth\n\n[Read More](https://www.gwav.com/artificial-intelligence-researcher)\n\n### Greenwave Technology Solutions Divests All Social Media Assets\n\nNovember 1, 2021\n\nGreenwave has no exposure to the cannabis industry and is focused exclusively on expanding its footprint of metal recycling facilities\n\n[Read More](https://www.gwav.com/divest-social-media)\n\n### Greenwave Technology Solutions Issues Chairman’s Letter\n\nOctober 18, 2021\n\nCompany plans to aggressively roll-up metal recycling facilities, expand its Board of Directors, and apply for a listing on the NASDAQ or NYSE.\n\n[Read More](https://www.gwav.com/copy-of-divest-social-media)\n\n[](https://www.gwav.com/copy-of-divest-social-media)\n\n### MassRoots Announces Plan to Adopt New Corporate Name “Greenwave Technology Solutions, Inc.”\n\nOctober 12, 2021\n\nNew Corporate Name Emphasizes Focus on Environmental Technology\n\n[Read More](https://www.gwav.com/copy-of-chairmans-letter)\n\n[](https://www.gwav.com/copy-of-chairmans-letter)\n\n### Empire Acquires Virginia Beach Metal Recycling Facility\n\nOctober 6, 2021\n\nLocated in Virginia’s largest city, the Company expects its 11th metal recycling facility will be one of its busiest locations in both revenue and recycling volume\n\n[Read More](https://www.gwav.com/copy-of-name-change)\n\n### MassRoots, Inc. To Present At Dawson James Securities 6th Annual Small Cap Growth Conference\n\nOctober 4, 2021\n\nMassRoots recently closed its acquisition of Empire Services, Inc. in a transaction valued at approximately $23.6 million.\n\n[Read More](https://www.gwav.com/copy-of-new-facility-aquired)\n\n[](https://www.gwav.com/copy-of-new-facility-aquired)\n\n### MassRoots Closes Acquisition of Empire Services, Inc.\n\nOctober 1, 2021\n\nAs a result of the Empire acquisition, MassRoots has shifted its business focus and plans to apply to uplist to a national exchange in the coming weeks\n\n[Read More](https://www.gwav.com/copy-of-new-facility-aquired-1)\n\n[](https://www.gwav.com/copy-of-new-facility-aquired-1)\n\n### MassRoots Issues Update on its Planned Acquisition of Empire Services, Inc., Which is Continuing its Expansion\n\nJuly 6, 2021\n\nMassRoots, Inc. recently entered into a Letter of Intent to acquire Empire Services, Inc., which is expected to result in MassRoots generating significant revenues and positive cashflows from operations\n\n[Read More](https://www.gwav.com/copy-of-closes-empire)\n\n[](https://www.gwav.com/copy-of-closes-empire)\n\nbottom of page\n"
        }
      ]
    }
  ]
}